"When compared to visual stimuli, auditory stimuli (noises) are:"::2:More likely to attract attention and more likely to be responded to in error.:Less likely to attract attention and less likely to be responded to in error.:Less likely to attract attention and more likely to be responded to in error.:More likely to attract attention and less likely to be responded to in error.::1 0 0 0::
"The blood carries________around the body and removes_______ from the body with the exchange
occurring in the____________."::2:Oxygen / Carbon Dioxide / Capillaries.:Carbon / Dioxide / Oxygen Veins.:Oxygen / Carbon Dioxide / Arteries.:Carbon Dioxide / Oxygen / Capillaries.::1 0 0 0::
"What is the antidote when a pilot has a hazardous attitude, such as ""Impulsivity""?"::2:Not so fast, think first.:It could happen to me.:Do it quickly to get it over with.:::1 0 0 0::
Dark adaptation takes about ____________ for the Rods, and ______________for the Cones.::2:30 minutes / 7 minutes.:15 minutes / 20 minutes.:7 minutes / 30 minutes.:25 minutes / 45 minutes.::1 0 0 0::
From the options below, choose the correct sequence of the various stages of the reasoning process.::2:Detection, Perception, Decisions taken, Action, Feedback.:Perception, Action, Feedback, Detection, Decisions taken.:Detection, Feedback, Decisions taken, Action, Perception.:Detection, Perception, Decisions taken, Feedback, Action.::1 0 0 0::
"Which of the following occur when a pilot is sitting too high in a cockpit?
a. Good downward outside view.
b. Poor view of instruments.
c. Upwards outside view obstructed."::2:a), b) and c).:only a).:a) and b) only.:a) and c) only.::1 0 0 0::
What effect does haze have on the ability to see traffic or terrain features during flight?::2:All traffic or terrain features appear to be farther away than their actual distance.:Haze causes the eyes to focus at infinity.:The eyes tend to overwork in haze and do not detect relative movement easily.:::1 0 0 0::
As a pilot, flying for long periods in hot summer temperatures increases the susceptibility::2:Of dehydration since the:Dry air at altitude tends to increase the rate of water loss from the body.:Moist air at altitude helps retain the body´s moisture.:Temperature decreases with altitude.::1 0 0 0::
"Which of the following attitudes and/or characteristics have b good communication and especially
dangerous when flying?"::2:Arrogance and aggressiveness.:A highly developed sense of leadership.:Respect for other peoples' opinions.:All of the above.::1 0 0 0::
"Loudness is measured in:"::2:Decibels.:Hertz.:Pascal’s.:Cycles per second.::1 0 0 0::
Carbon monoxide in an aircraft cabin is::2:Difficult to recognize because of its odorless and colorless.:Easily recognizable because of its peculiar odor.:Easily recognizable because of its peculiar color.:::1 0 0 0::
"You have planned to take a couple of friends on an air experience flight. On the day, the weather
conditions are marginal and there is a strong cross-wind on the runway. As a competent assessor of
risk, which of the following decisions should you take?"::2:Reschedule the flight for another time, discounting the immediate disappointment to your friends.:Get airborne as planned, as it is always wise to stick to your flight plan if you possibly can.:Proceed with the flight and treat it as an opportunity to practise flying in adverse conditions.:"Ask your friends if they are prepared to fly in the prevailing conditions, before assessing the
situation yourself."::1 0 0 0::
"Which of the following are terms generally used to describe a type or types of memory within the
subject of Human Performance and Limitations?"::2:Long-term memory.:Sensitive memory.:Felicitous memory.:All of them.::1 0 0 0::
During a climb to 18,000 ft, the percentage of oxygen in the atmosphere::2:Remains the same.:Increases.:Decreases.:::1 0 0 0::
The pulse is generated by the contraction of which heart chamber?::2:Left Ventricle.:Left Auricle.:Right Ventricle.:Right Auricle.::1 0 0 0::
"Complete the following statement. The most appropriate time for a pilot to give passengers an initial
briefing on emergency procedures is:"::2:During a pre-flight safety briefing.:At the moment any emergency occurs; it is not necessary to worry them before that.:While waiting at the hold for take-off.:Just after take-off.::1 0 0 0::
"In the aeronautical decision making (ADM) process, what is the first step in neutralizing a hazardous
attitude?"::2:Recognizing hazardous thoughts.:Making a rational judgment.:Recognizing the invulnerability of the situation.:::1 0 0 0::
What is noise induced hearing loss?::2:Loss of hearing due to damage to the cochlea.:Loss of hearing due to damage to the ossicles.:Loss of hearing due to damage to the vestibular apparatus.:Loss of hearing due to damage to the middle ear.::1 0 0 0::
"Hypermetropia and Myopia are normally caused by:"::2:A misshapened eye ball.:Eye strain.:Stress.:Badly fitting spectacles.::1 0 0 0::
"Hypermetropia is caused by a____________eyeball and treated by a_________ whereas Myopia is
caused by a_____________eyeball and treated with"::2:Shortened / convex / lengthened / concave.:Lengthened / convex / shortened / concave.:Shortened / concave / lengthened / convex.:Lengthened / concave / shortened / convex.::1 0 0 0::
"Air in the atmosphere is made up of:"::2:Nitrogen (78 %), Oxygen (21%), Carbon Dioxide (0.03%) and Argon (1%).:Nitrogen (78%), Oxygen (21%), Carbon Dioxide (0.03%) and Hydrogen (1%).:Nitrogen (1%), Oxygen (78%), Carbon Dioxide (21%) and Argon (0.03%).:Nitrogen (21%), Oxygen (0.03%), Carbon Dioxide (78%) and Argon (1%).::1 0 0 0::
It is generally accepted that the short-term memory can hold how many items long ?::2:7 items for 10-20 seconds.:4 items for 15 seconds.:15 items for 1-5 minutes.:7 items for 5-10 minutes.::1 0 0 0::
What causes conductive deafness?::2:Damage to the ossicles or the eardrum.:Damage to the outer ear.:Damage to the pinna.:Damage to the middle ear.::1 0 0 0::
Rapid or extra deep breathing while using oxygen can cause a condition known as::2:Hyperventilation.:Aerosinusitis.:Aerotitis.:::1 0 0 0::
Which of the following will give the illusion that the aircraft is too low during an approach?::2:A down-sloping runway.:An up-sloping runway.:A brightly lit aerodrome in an otherwise dark area.:A narrower than normal runway.::1 0 0 0::
"At altitude, the volumetric proportion of oxygen in the atmosphere is:"::2:The same as at mean sea level (MSL).:Higher than at MSL:Lower than at MSL.:Dependent on the actual altitude.::1 0 0 0::
"Mental Overload usually:"::2:Leads to degraded performance.:Leads to better performance.:Has no effect on performance.:Causes changes in the speed and accuracy of performance which vary from individual to individual.::1 0 0 0::
After donating blood, what is the minimum time a pilot should wait before flying?::2:24 hours.:2 hours.:12 hours.:48 hours.::1 0 0 0::
If advice is needed concerning possible flight with an illness, a pilot should contact::2:An Aviation Medical Examiner.:Their family doctor.:The nearest hospital.:::1 0 0 0::
A rapid acceleration can create the illusion of being in a::2:Nose up attitude.:Left turn.:Nose down attitude.:::1 0 0 0::
Approximately how long does it take a person to dissipate one unit of alcohol from the blood?::2:1 hour.:1/2 hour.:2 hours.:12 hours.::1 0 0 0::
"The frequency band that a healthy young person can hear is :"::2:20 - 20,000 cycles per second.:70 - 15.000 cycles per second.:80- 20.000 cycles per second.:500 - 15.000 cycles per second.::1 0 0 0::
"When a person is experiencing stress or fear, adrenaline is released into the blood stream causing
immediate:"::2:Increase in the pulse-rate.:Fatigue.:Loss of consciousness.:Decrease in the pulse-rate.::1 0 0 0::
"A likely symptom, or likely symptoms, of Hypoxia might be:"::2:Increased heart rate.:Cyanosis.:Formication.:All of the above.::1 0 0 0::
Which statement best defines hypoxia?::2:A state of oxygen deficiency in the body.:An abnormal increase in the volume of air breathed.:A condition of gas bubble formation around the joints or muscles.:::1 0 0 0::
Which procedure is recommended to prevent or overcome spatial disorientation?::2:Rely entirely on the indications of the flight instruments.:Avoid steep turns and rough control movements.:Reduce head and eye movements to the greatest extend possible.:::1 0 0 0::
"Which gas, which is absorbed by the body during normal breathing, plays an important role in
decompression sickness?"::2:Nitrogen.:Oxygen.:Carbon Dioxide.:Carbon Monoxide.::1 0 0 0::
"The Vestibular Apparatus detects_____________.acceleration:"::2:Angular and linear.:Linear.:Angular.:"Positive ""g""."::1 0 0 0::
"Who is responsible for determining whether a pilot is fit to fly for a particular flight, even though he
or she holds a current medical certificate?"::2:The pilot.:The medical examiner.:The FA-1.:::1 0 0 0::
Which would most likely result in hyperventilation?::2:Emotional tension, anxiety, or fear.:The excessive consumption of alcohol.:An extremely slow rate of breathing and insufficient oxygen.:::1 0 0 0::
An analogue display is generally better than a digital display for showing which sort of data?::2:Qualitative.:Quantitative.:Numerical.:Subjective.::1 0 0 0::
"The condition whereby the body does not enough oxygen to function correctly is known as:"::2:Hypoxia.:Hypotension.:Hyperventilation.:Hyperglycemia.::1 0 0 0::
"A person may not act as a crewmember of a civil aircraft if alcoholic beverages have been
consumed by that person within the preceding"::2:8 hours:12 hours.:24 hours.:::1 0 0 0::
