"If the Angle of Attack is increased beyond the Critical Angle of Attack, the wing will no
longer produce sufficient lift to support the weight of the aircraft:"::2:Regardless of airspeed or pitch attitude.:Unless the airspeed is greater than the normal stall speed.:Unless the pitch attitude is on or below the natural horizon.:In which case, the control column should be pulled-back immediately.::1 0 0 0::
"Which of the answer options most correctly completes the sentence? The amount of lift a wing
produces is directly proportional to:-"::2:The air density.:The dynamic pressure minus the static pressure.:The square root of the velocity of the air flowing over it.:The air temperature.::1 0 0 0::
"The definition of lift is:"::2:The aerodynamic force which acts at 90° to the relative airflow.:The aerodynamic force which acts perpendicular to the chord line of the aerofoil:The aerodynamic force that results from the pressure differentials about an aerofoil.:. The aerodynamic force which acts perpendicular to the upper surface of the aerofoil.::1 0 0 0::
"The surface that gives an aircraft directional stability is:"::2:The fin.:The rudder.:The horizontal tailplane.:The rudder trim tab.::1 0 0 0::
"The angle of climb is proportional to:"::2:The amount by which the thrust exceeds the drag.:The amount by which the lift exceeds the weight.:The amount by which the thrust exceeds the weight.:The angle of attack of the wing.::1 0 0 0::
"When considering the changes in density of the air with altitude, which of the
following four options is correct?"::2:The reduction in pressure with increasing altitude causes density to reduce:The increase in pressure with increasing altitude causes density to reduce.:The temperature reduction with increasing altitude causes density to increase.:The temperature increase with increasing altitude causes density to increase::1 0 0 0::
"When flaps are lowered the stalling angle of attack of the wing:"::2:Decreases, but CLMAX increases:Remains the same, but CLMAX increases.:Increases and CLMAX increases:Decreases, but CLMAX remains the same.::1 0 0 0::
"Dynamic pressure is:"::2:"The amount by which the pressure rises at a point where a moving airflow is brought
completely to rest.":. The total pressure at a point where a moving airflow is brought completely to rest.:The pressure due to the mass of air pressing down on the air beneath.:"The pressure change caused by heating when a moving airflow is brought completely to
rest."::1 0 0 0::
"If, on a given day, the actual outside air temperature at 4000 ft is 23°C, what is the approximate
difference between the actual and ISA temperature?"::2:16°C.:7°C:15°C.:8°C.::1 0 0 0::
As airspeed increases induced drag_____, parasite drag_____and total drag::2:Decreases / Increases / Decreases then increases.:Increases / Increases / Increases:Increases / Decreases / Increases then decreases.:Decreases / Decreases / Decreases::1 0 0 0::
"What must be the relationship between the forces acting on an aircraft in flight, for that aircraft to
be in a state of equilibrium?"::2:Lift must equal weight, and thrust must equal drag:Lift must equal drag, and thrust must equal weight:Lift must equal thrust plus drag.:Lift must equal thrust, and weight must equal drag.::1 0 0 0::
"An aileron could be balanced aerodynamical I y by:"::2:Having the control hinge set back behind the control surface leading edge.:Making the up aileron move through a larger angle than the down aileron.:Attaching a weight to the control surface forward of the hinge:Having springs in the control circuit to assist movement::1 0 0 0::
"Following re-trimming for straight and level flight, in an aircraft with a C of G near its
forward limit, and an elevator fitted with a conventional trim-tab:"::2:Nose-up pitch authority will be reduced:Nose-down pitch authority will be reduced.:Longitudinal stability will be reduced.:Tailplane down-load will be reduced.::1 0 0 0::
Which flying control surface(s) give(s) control about the aircraft's normal axis?::2:The rudder.:The ailerons.:The elevator.:The flaps.::1 0 0 0::
"If the Centre of Gravity (C of G) of an aircraft is found to be within limits for take-off:"::2:The CofG limits for landing must be checked, allowing for planned fuel consumption.:The CofG will always be within limits for landing.:The CofG will not change during the flight.:"The flight crew will always be certain of being able to adjust the C of G during flight in order
to keep it within acceptable limits for landing."::1 0 0 0::
"The maximum gliding distance from 6000 feet, for an aircraft in clean configuration, with a lift/drag
ratio of 8:1, is approximately 8 nautical miles. If flaps are deployed:"::2:The maximum gliding distance will be less.:. The maximum gliding distance will increase.:Lift/Drag ratio will be unaffected but will be achieved at a lower airspeed.:. The maximum gliding distance will be unaffected.::1 0 0 0::
"With the flaps lowered, the stalling speed will:"::2:Decrease:Increase.:Increase, but occur at a higher angle of attack.:Remain the same.::1 0 0 0::
