When an aircraft is in a steady climb, the aerodynamic lift is_____the weight.::2:Less than.:Balanced by.:Equal to:Greater than::1 0 0 0::
"If in level flight the airspeed decreases below that for maximum Lift/Drag, the effect will be that:"::2:Drag increases because of increased induced drag.:Drag decreases because of lower induced drag:Drag increases because of increased parasite drag.:Drag decreases because of lower parasite drag.::1 0 0 0::
"The purpose of a trim tab is:"::2:To zero the load on the pilots controls in the flight attitude required.:To assist the pilot in initiating movement of the controls.:To provide feel to the controls at high speed.:To increase the effectiveness of the controls::1 0 0 0::
"The properties of the Earth s atmosphere which influence the performance of aircraft are:"::2:Its water vapour content, temperature, pressure and density.:Its temperature, pressure and humidity:Its oxygen content pressure, and water vapour content:Its nitrogen content, oxygen content, temperature and pressure.::1 0 0 0::
"The air flow over the wing's upper surface in straight and level flight, when compared with the
airflow that is unaffected by the wing, will have:"::2:A higher velocity:A higher density:A reduced velocity.:The same velocity.::1 0 0 0::
"The stalling speed of an aircraft in straight and level flight is 60 kt, IAS. What is its stalling
speed in a level 60° banked turn?"::2:85 kt:60 kt:43 kt:120 kt::1 0 0 0::
"Which of the four answer options most correctly completes the sentence? Increasing speed also
increases lift because:"::2:"The increased speed of the air passing over an aerofoil's upper surface decreases the static
pressure above the wing, thus creating a greater pressure differential across the upper and
lower surface":Lift is directly proportional to velocity.:The increased velocity of the relative wind overcomes the increased drag.:. Increasing speed decreases drag.::1 0 0 0::
"A piston engine aircraft fiies in that layer of the atmosphere called:"::2:The Troposphere:The Stratosphere.:The Mesosphere.:. The Tropopause.::1 0 0 0::
"Fixed trim tabs on ailerons:"::2:. Can be adjusted on the ground after a test flight to make wings-level flight easier.:Can be adjusted during flight.:Should never be adjusted.:Can be adjusted on the ground after a test flight to make turning easier.::1 0 0 0::
"If the Angle of Attack and other factors remain constant, and the airspeed is doubled, lift will be:"::2:Quadrupled.:Doubled.:One quarter of what it was.:The same.::1 0 0 0::
"The purpose of a spring-bias trim system is:"::2:"To reduce to zero the effort required by the pilot to counter stick force, after making a
control movement":To maintain a constant tension in the trim tab system.:To increase the feel in the control system:To compensate for temperature changes in cable tension.::1 0 0 0::
"As airspeed increases, induced drag:"::2:Decreases:Increases.:Is dependant on the weight of the aircraft:Remains unchanged.::1 0 0 0::
