"Minkä olotilaa parantavan keinon voisit kertoa lentäjäystävällesi, jolla on
matkapahoinvointia?"::2:Vältä tarpeetonta pään liikuttamista ja pidä katseesi ilma-aluksen ulkopuolella.:Hengitä paperipussiin.:Ota matkapahoinvointiin soveltuvaa lääkettä.:Laske pääsi alaspäin, sulje silmäsi ja hengitä syvään.::1 0 0 0::
Huulien sinertyminen johtuu::2:hapenpuutteesta:g-voimista:hyperventilaatiosta:barodontalgiasta::1 0 0 0::
"Tupakointi heikentää hapen saantia, se johtuu:"::2:lievästä hiilimonoksidi intoksikaatiosta:alveoleissa tapahtuvan diffusion heikkenemisestä:akuutista keuhkoemboliasta:ateroskleroosista::1 0 0 0::
TUC (time of useful consiusness, hyödyllisen tajunnan aikareservi) 30 000 ft?::2:~ 45 sek:1 ? 2 sek:5 min:10 min::1 0 0 0::
Mikä seuraavista kaasuista on merkityksellisessä osassa sukeltajan tautia?::2:Typpi.:Vety.:Happi.:Hiilidioksidi.::1 0 0 0::
"Kansainvälisen standardi-ilmakehän (ISA) mukaisesti, korkeuden kasvaessa
stratosfäärissä, lämpötila:"::2:Kasvaa.:Pysyy lähes muuttumattomana (-56 Celsius astetta).:Vaihtelee plus- ja miinusasteiden välillä.:Vähenee.::1 0 0 0::
"Jos lentäjä on tottunut lentämään suhteellisen saastuneessa ja utuisessa ympäristössä ja tämän 
jälkeen hän lentää hyvin kirkkaassa ja selkeässä ympäristössä:"::2:Kaukaiset kohteet saattavat näyttää olevan lähempänä kuin oikeasti ovat.:Kaukaiset kohteet saattavat näyttää olevan kauempana kuin oikeasti ovat.:Lentäjä saattaa sekoittaa lähellä olevat kohteet kaukana oleviin.:Lähellä olevat kohteet saattavat näyttää olevan kauempana kuin ne oikeasti ovat.::1 0 0 0::
Onko lääkekuurin aikana suositeltua lähteä lentämään ilma-alusta?::2:Ei, ellei ole ilmailulääketieteen asiantuntijan hyväksyntää.:Ei, koskaan ei ole soveliasta lentää lääkkeiden käytön aikana.:Kyllä, kunhan kyseessä ei ole reseptilääkkeet.:Kyllä, kunhan kyseessä on antibiootit, sillä niillä ei ole sivuvaikutuksia.::1 0 0 0::
"Olet valmistelemassa koululentoa lennonopettajan kanssa ja huomaat, että
tarkistuslista on kadoksissa. Mitä teet?"::2:Etsit tarkistuslistan silläkin uhalla, että saatat menettää osan päivän lentoajastasi.:Suoritat tarkastukset ulkomuistista.:Luotat siihen, että lennonopettaja huomauttaa kaikesta mitä sinä mahdollisesti unohdat.:Otat erityyppisestä ilma-aluksesta tarkistuslistan lainaksi.::1 0 0 0::
Mitkä ovat normaalit verenpainearvot?::2:120/80:160/90:70/130:90/150::1 0 0 0::
Kuinka monta päivää aiemmin medikaalin voi uusia, jotta se kirjoitettaisiin samalle päivälle kuin alkuperäinen?::2:45 pv:15 pv:30 pv:60 pv::1 0 0 0::
Mikä elin säätelee kaikkia muita kehon toimintoja?::2:Aivot.:Selkäydin.:Sydän.:Keuhkot.::1 0 0 0::
"Kansainvälisen standardi-ilmakehän (ISA) mukaisesti, korkeuden kasvaessa
troposfäärissä, paine:"::2:Pienenee.:Ei vaikutusta, sillä ilmanpaine ei ole riippuvainen korkeudesta.:Pysyy samana.:Suurenee.::1 0 0 0::
Käsiä kihelmöi ja sydän lyö tiheästi. Mikä tämän aiheuttaa?::2:hyperventilaatio :hypoksia:alipainetauti:ruokamyrkytys::1 0 0 0::
Puhuttaessa hypoksiasta, mikä seuraavista on totta?::2:Ihon kihelmöinti ja yleinen huolettomuus ovat hypoksian oireita.:Hypoksian aiheuttaa typpikuplat nivelissä ja verenkierrossa.:Keskittymällä tietoisesti lennonvalvontamittareihin voidaan sietää hypoksian oireita.:Hypoksia on aina helppo havaita.::1 0 0 0::
"Mikä seuraavista aiheuttaa harha-aistimuksen siitä, että ilma-alus on liian
matalalla lähestymisen aikana?"::2:Kiitotie alamäkeen.:Normaalia kapeampi kiitotie.:Kiitotie ylämäkeen.:Voimakkaasti valaistu lentokenttä, muuten pimeässä ympäristössä.::1 0 0 0::
"Jotta et unohda tärkeitä asioita tai toimenpiteitä, käytä aina:"::2:Tarkoituksenmukaista tarkistuslistaa.:Lentokäsikirjaa.:Lentokelpoisuustodistusta.:Merkittyjä ilmanopeuksia.::1 0 0 0::
Tilanne, jossa keho ei saa tarpeeksi happea toimiakseen oikein, on nimeltään?::2:Hypoksia.:Hypotensio.:Hyperglykemia.:Hyperventilaatio.::1 0 0 0::
Mikä virhetyyppi on kyseessä? Tahallisesti lennetään alle minimilentokorkeuden.::2:Rikkomus:Lipsahdus:Erehdys:Muistivirhe::1 0 0 0::
"Nopea kiihdytys saattaa aiheuttaa harha-aistimuksen siitä, että ilma-alus olisi:"::2:Nousussa.:Syöksykierteessä.:Liu'ussa.:Vasemmassa kaarrossa.::1 0 0 0::
Paineenvaihtelut lennon aikana voivat aiheuttaa::2: poskiontelokipuja: tasapainosaistin heikentymistä: kipuja alaraajoihin: harha-aistimuksia kaarrosta::1 0 0 0::
"Biologinen kello häiriintyy kun: a) yö on nukuttu huonosti, b) päivällä lennät reitin Amsterdam - New York, c) päivällä lennät reitin Amsterdam - Johannesburg, d) yöllä lennät reitin New York - Amsterdam"::2:b ja d oikein:a ja c oikein:kaikki väärin:kaikki oikein::1 0 0 0::
Hiilimonoksidi (CO) eli häkä on ::2: hyvin myrkyllinen hajuton kaasu: savunhajuinen kaasu, joka saattaa paljastaa pakoputken vuodon ohjaamon lämmitysjärjestelmään.: kaasu, joka vereen liuetessaan lisää veren hyytymistaipumusta: kaasu, jota ilmakehässä on noin 0,04%::1 0 0 0::
"Hengitettäessä 100 % lisähappea, veren happipitoisuus vastaa merenpintatasoa korkeudella:"::2:33 000 ft:23 000 ft:20 000 ft:15 000 ft::1 0 0 0::
Lentokoneen ohjaamomiehistön jäsenen veren alkoholipitoisuus saa olla lentotoiminnan aikana::2:0,0 promillea: 0,05 promillea: 0,5 promillea, eli sama kuin maaliikenteessä: sama, kuin merenkulussa::1 0 0 0::
Mikä aiheuttaa konduktiivisen kuulovaurion?::2:Mikä tahansa äänen johtumista estävä tekijä esim. korvakäytävän tukkiva vaikku.:Vaurio korvalehdessä.:Vaurio ulkokorvassa.:Vaurio välikorvassa.::1 0 0 0::
Nuhaisena lentäminen::2: pahentaa korvien lukkoontumistaipumusta: voi aiheuttaa harha-aistimuksia kaartamisesta: parantaa nuhan nopeasti: aiheuttaa usein äkillisiä huimauskohtauksia::1 0 0 0::
"Mitä sellaisen lentäjän tulisi ajatella, jolla on taipumusta vaaralliseen
asennoitumiseen, kuten impulsiivisuuteen?"::2:Ei niin nopeasti, ajattele ensin.:Se voisi sattua myös minulle.:Tee se nopeasti, jotta saat sen tehtyä.:En välitä.::1 0 0 0::
"Mikä seuraavista väittämistä on oikein:"::2:Arviointikyky voi heiketä jo pienestäkin alkoholimäärästä.:Ihmisen keho polttaa alkoholia nopeammin, jos sen kanssa nautitaan kahvia.:Lentokorkeuden lisääminen vähentää alkoholin haitallisia vaikutuksia.:Alkoholi parantaa näön tarkkuutta.::1 0 0 0::
"Olet varannut ilma-aluksen lentoasi varten, mutta olet hieman flunssainen ja
kärsit lievästä nenän ja sivuonteloiden tukkoisuudesta. Miten toimit asian
suhteen?"::2:Jätät lennon lentämättä.:Lennät ihan normaalisti.:Lennät, mutta ainoastaan pienillä pystynopeuksilla noustessa ja laskeutuessa.:Otat tukoksen avaavaa lääkettä 1/2 tuntia ennen lentoa.::1 0 0 0::
"Likinäköisyys on tila, jossa silmä pyrkii luonnostaan tarkentamaan:"::2:Noin 1 - 2 metrin etäisyydelle.:Äärettömyyteen.:Noin 20 - 500 metrin etäisyydelle.:Horisonttiin.::1 0 0 0::
"Täydennä seuraava lause. Soveltuvin ajankohta lentäjän suorittamalle
matkustajien ohjeistukselle hätätilanteissa on:"::2:Ennen lentoa suoritettavan turvallisuusohjeistuksen aikana.:Heti lentoonlähdön jälkeen.:Odotuspaikalla lentoonlähtöä odotellessa.:Hätätilanteen ilmetessä; ei ole tarvetta huolehtia hätätilanneohjeistuksista aikaisemmin.::1 0 0 0::
Lennät korkeudella FL300 ja paineistus häviää, vatsa turpoaa. Mikä seraavista väittämistä on oikein?::2:lentokorkeuden vähentäminen pienentää turvotusta:100% hapen hengittäminen auttaa:vatsan paisuminen on alipainetaudin oire:vatsan paisuminen on shokin oire::1 0 0 0::
"Valitse seuraavista oikeassa järjestyksessä olevat tiedonkäsittelyprosessin osaalueet:"::2:Havainnointi, tiedon käsittely, päätöksenteko, toiminta, palaute.:Tiedon käsittely, toiminta, palaute, havainnointi, päätöksenteko.:Havainnointi, tiedon käsittely, päätöksenteko, palaute, toiminta.:Havainnointi, palaute, päätöksenteko, toiminta, tiedon käsittely.::1 0 0 0::
Hämärässä näkemiseen käytetään?::2:Sauvasoluja:Tappisoluja :Piikkisoluja:Värekarvoja::1 0 0 0::
Mikä on tehokkain tapa katsoa yölennolla?::2:Tähyile hitaasti, jotta vältät katsomasta suoraan kohdetta.:Lisää sisätilan valaistusta.:Keskitä katseesi jokaiseen kohteeseen suoraan muutaman sekunnin ajan.:Katso ainoastaan kaukaisuuteen ja himmennä valot.::1 0 0 0::
Hyperventilaatio?::2:Veri muuttuu emäksisemmäksi (pH-arvo nousee):Veren hiilidioksiditaso nousee:Veren happipitoisuus laskee:Veren bikarbonaattipitoisuus kompensatorisesti laskee::1 0 0 0::
"Kaukotaitteisuuden ja likitaitteisuuden aiheuttaa yleensä:"::2:Epämuodostunut silmämuna.:Stressi.:Silmän rasitus.:Huonosti istuvat silmälasit.::1 0 0 0::
Tyypillinen oire hapenpuutteessa on::2: arvostelukyvyn heikentyminen: vatsakipu: korvien vinkuminen (tinnitus): painon tunne raajoissa::1 0 0 0::
"Vaarallista asennoitumista esiintyy jokaisella lentäjällä jollakin tasolla ja jonkin
aikaa. Mitä tällaisia vaarallisia asennoitumisia on?"::2:"Auktoriteettivastaisuus, impulsiivisuus, machoilu, vetäytyvyys ja haavoittumattomuuden
tunne.":Kaikki vastaukset ovat oikein.:Huono tilannetietoisuus, nopeasti tuomitseva ja puutteellinen päätöksentekokyky.:Huono riskien hallinta ja stressin hallinnan puute.::1 0 0 0::
Mikä voi vaikuttaa siihen, että lentäjä ei kestä vähäisiäkään G-voimia?::2:Lentäjän väsymys.:Kaikki vastaukset ovat oikein.:Ilma-aluksen maksimikuormituskerroin.:Huonokuuloisuus, joka on aiheutunut aistisolujen vähitellen rappeutuessa(presbyacusis).::1 0 0 0::
"Positiivisen G-voiman lisääntyessä:"::2:sydämen lyöntitiheys kasvaa:sydämen lyöntitiheys laskee:veri pakkautuu päähän:silmän paine nousee::1 0 0 0::
"Mikäli lentäjänä tarvitset neuvoa mahdollisesta lentämisestä sairaana, otat yhteyttä:"::2:Ilmailulääkäriin.:Perheen omalääkäriin.:Yleislääkäriin.:Lähimpään terveyskeskukseen.::1 0 0 0::
"Asentoaistin kannalta tärkeimmät ovat:"::2:silmät:vestibulaarielin ja kaarikäytävät:kuulokivet:korvat::1 0 0 0::
Hämäränäkökyky::2: heikkenee hapenpuutteen vaikutuksesta: sijaitsee tappi-aistinsoluissa: kehittyy välittömästi hämärään jouduttaessa: sijaitsee silmän sarveiskalvossa::1 0 0 0::
Ilmakehässä on typpeä noin?::2:78%:1%:21%:33%::1 0 0 0::
"Positiivinen kolmivaiheprosessi vaihdettaessa ohjaimia ilma-aluksessa lentäjien
välillä sisältää seuraavat sanonnat: (a) Sinä ohjaat, (b) Minä ohjaan ja (c) ____."::2:Minun ilma-alus.:Minä ohjaan.:Sinä ohjaat.:Minun ilma-alus ja minä ohjaan.::1 0 0 0::
Mitä ovat stressitekijät?::2:Tapahtumat ja tilanteet, jotka aiheuttavat stressiä.:Henkilöstä päällepäin näkyvän stressin määrä.:Tekijät, jotka lisäävät pulssia.:"Tilanteet ja tapahtumat, jotka aiheuttavat mitä tahansa reaktioita ihmisen elimistölle
asetettuihin vaatimuksiin."::1 0 0 0::
Montako yksikköä ja kuinka kauan lyhytaikainen muistimme pystyy pitämään?::2:7 yksikköä, 10-20 sekuntia:7 yksikköä, 5-10 minuuttia:15 yksikköä, 1-5 minuuttia:4 yksikköä, 15 sekuntia::1 0 0 0::
Kuinka kauan ihmissilmän hämäräadaptaation kehittyminen kestää?::2:~ 30 min:~1 min:~ 5 min:~ 60 min::1 0 0 0::
Mitkä tekijät vaikuttavat melun aiheuttamaan huonokuuloisuuteen?::2:Yli 90 desibelin ylittävän melun voimakkuus ja kesto.:Yli 110 desibelin ylittävän melun kesto.:Yli 100 desibelin ylittävän melun voimakkuus ja kesto.:Yli 100 desibelin ylittävän melun kesto.::1 0 0 0::
"Paikallispuudutuksen jälkeen lentäjän pitäisi odottaa vähintään _____ ennen
lentämistä:"::2:12 tuntia.:24 tuntia.:2 tuntia.:48 tuntia.::1 0 0 0::
"Kansainvälisen standardi-ilmakehän (ISA) mukaisesti, korkeuden kasvaessa
troposfäärissä, lämpötila:"::2:Pienenee.:Pysyy samana.:Suurenee.:Ei vaikutusta, sillä se ei ole riippuvainen korkeudesta.::1 0 0 0::
pimeässä ja huonossa näkyvyydessä asiat näyttävät olevan?::2:Kauempana kuin ne todellisuudessa ovat:Lähempänä kuin mitä ne todellisuudessa ovat:ei vaikuta mitenkään:mahdoton havaita::1 0 0 0::
"Kuinka kauan keskimäärin ihmisellä kestää kuluttaa yksi yksikkö alkoholia
verestään?"::2:2 tuntia.:12 tuntia.:5 tuntia.:1/2 tuntia.::1 0 0 0::
"Lentokoneen matkustamossa esiintyvä häkä on:"::2:Vaikea havaita, koska häkä on hajuton ja väritön.:Helppo havaita, koska sillä on erikoinen väri.:Helppo havaita, koska sillä on erikoinen haju.:"Helpompi havaita lennettäessä yli 18,000 jalan korkeudella, koska hapen määrä
pienenee."::1 0 0 0::
"Mihin perustuu riskien hallinta ilmailun päätöksentekoprosessissa, jolla
vähennetään jokaisella lennolla olevia riskejä?"::2:Kaikki vastaukset ovat oikein.:Tilannetietoisuus, ongelmien tunnistaminen ja hyvä harkinta.:"Tietyssä tilanteessa kaiken tiedon analysointi henkisellä tasolla ja ajoissa tehdyt
päätökset tarvittavista toimenpiteistä.":Stressin hallinnan soveltaminen ja riskin alkutekijämenetelmä.::1 0 0 0::
"Kun lentäjä lentää pitkiä aikoja kuuman kesäpäivän aikana, hän saattaa altistua
nestehukkaan koska:"::2:"Lentokorkeuksissa lennettäessä kuivalla ilmalla on taipumus lisätä nesteen häviämistä
kehosta.":Lentokorkeuksilla kostea ilma auttaa säilyttämään kehon nestetasapainon.:Lämpötila kasvaa noustaessa korkeammalle.:Lämpötila pienenee noustaessa korkeammalle.::1 0 0 0::
"Täytä puuttuviin kohtiin eniten oikeat vaihtoehdot kaasupareista: Punasoluissa
oleva hemoglobiini kiinnittyy paremmin ______ kuin ______."::2:Hiilimonoksidiin/happeen.:Typpeen/Happeen.:Hiilidioksidiin/Typpeen.:Happeen/Typpeen.::1 0 0 0::
Mitkä seuraavista aina vaikuttavat lentokykyyn?::2:Reseptillä saatavat vahvat kipulääkkeet ja antihistamiinit.:Homeopaattiset valmisteet.:Antibiootit.:Käsikaupasta saatavat kipulääkkeet ja antihistamiinit.::1 0 0 0::
"Jos henkilö on ollut sukeltamassa eikä ole ollut tarvetta käyttää hallittua nousua,
hänen suositeltu odotusaikansa ennen seuraavaa 8000 jalan korkeuteen
(matkustamon painekorkeus) asti ulottuvaa lentoaan on:"::2:12 tuntia.:4 tuntia.:48 tuntia.:24 tuntia.::1 0 0 0::
"Keho saa energiansa:"::2:Hiilihydraateista, proteiineista ja rasvoista.:Kivennäisaineista ja vitamiineista.:Kivennäisaineista, hiilihydraateista ja vitamiineista.:Proteiineista ja vitamiineista.::1 0 0 0::
"Hyväksytyn tarkistuslistan johdonmukainen noudattaminen on merkki:"::2:Kurinalaisesta ja pätevästä lentäjästä.:Lentäjästä, jolla on vaillinaiset tiedot kyseisestä aiheesta.:Lentäjästä, jolla on huono stressinsietokyky.:Kokemattomasta lentäjästä.::1 0 0 0::
Mikä voi vaikuttaa siihen, että verenpaine on koholla?::2:Kaikki vastaukset ovat oikein.:Tupakointi.:Ikä.:Stressi.::1 0 0 0::
"Suoran vaakalennon aikana suoritettu suoraviivainen kiihdytys saattaa aiheuttaa
tuntemuksen, että koneen nokka nousee ylös. Tällaisessa tilanteessa lentäjän pitää:"::2:Olla välittämättä tasapainoelimen tuntemuksista ja luottaa mittarinäyttämiin.:Luottaa tasapainoelimeen säilyttääkseen asentonsa.:"Luottaa ""perstuntoon"" ja tehdä sen avulla tarvittavat korjaukset.":Korjata nokan asennonmuutos työntämällä ohjaussauvaa hieman eteenpäin.::1 0 0 0::
"Jos Eustachin putkesi (korvatorvi) on tukossa, etkä pysty avaamaan korviasi,
toimit seuraavasti:"::2:Jätät lentämättä kunnes Eustachin putken (korvatorven) tukos on auennut.:Jatkat lentoasi, mutta sinun tulee niellä voimakkaasti ja usein.:Aukaiset nenäsi nenäsumutteella ennen lentoa.:Lennät ainoastaan matkustajana.::1 0 0 0::
"Mikä seuraavista asenteista ja luonteenpiirteistä on huonoa kommunikointia ja
ovat erityisen vaarallisia lentämisen yhteydessä?"::2:Ylimielisyys ja aggressiivisuus.:Vahva tunne johtajuudesta.:Toisten ihmisten mielipiteiden kunnioittaminen.:Kaikki vastaukset ovat oikein.::1 0 0 0::
"Mitä sellaisen lentäjän tulisi ajatella, jolla on taipumusta vaaralliseen
asennoitumiseen, kuten auktoriteettivastaisuuteen?"::2:Noudata sääntöjä.:Tiedän mitä olen tekemässä.:En välitä.:Säännöt eivät päde tässä tapauksessa.::1 0 0 0::
Minkä korkeuden yläpuolella lentäjien tarvitsee hengittää lisähappea?::2:10,000 ft.:20,000 ft.:8,000 ft.:2,000 ft.::1 0 0 0::
Näkökenttä kapenee::2:positiivisesta G-voimasta johtuen:yöllä:negatiivisesta G-voimasta johtuen:sateessa::1 0 0 0::
Mikä seuraavista elimistä on kaikkein luotettavin yksittäinen aistitiedonlähde?::2:Silmä.:Aivokuori.:Korva.:Nenä.::1 0 0 0::
Taitava pilotti?::2:jakaa tarkkaavaisuutta yhdelle asialle kerrallaan:tekee montaa asiaa yhtä aikaa:tekee kaiken ulkomuistista:ei ajattele, vaan toimii::1 0 0 0::
"Jos kone mittarilennossa IMC:ssä tuntuu olevan oikean kaarron lopettamisen jälkeen kaarrossa vasemmalle,"::2: on kyseessä kaarikäytävien toiminnasta johtuva harha-aistimus ja lentotila pitää tulkita oikein mittareista: tulee tämä vasen kaarto lopettaa normaalisti ohjaamalla: tulee varmistua, ettei kone vajoa ennen mitään korjausliikkeitä: tulee heti tarkistaa, että kuula on keskellä::1 0 0 0::
"Veri kuljettaa ____ kehossa ja poistaa ____. Näiden aineiden vaihto tapahtuu
____."::2:Happea / Hiilidioksidia / Keuhkokapillaareissa.:Happea / Hiilidioksidia / Valtimoissa.:Hiilidioksidia / Happea / Keuhkokapillaareissa.:Hiiltä / Dioksidia / Happisuonissa.::1 0 0 0::
Valikoiva tarkkaavaisuus tarkoittaa::2: jatkuvaa tiedon valikointia runsaasti saapuvasta aistitiedosta: informaation erittäin kriittistä arviointia: toiminnan tulosten tarkastelua eli palautekritiikkiä: kykyä tehdä useita asioita samanaikaisesti::1 0 0 0::
Jos eustachin putki tukkeutuu?::2:Välikorvan paine ei pääse tasaantumaan:Poskiontelot ovat tukossa:silmät vuotavat:Nenästä ei tule räkää::1 0 0 0::
"Pienlentokoneissa yleisesti käytetty kolmella osoittimella varustettu
korkeusmittari:
a) On helppo lukea väärin.
b) Tuskin koskaan luetaan väärin.
C) On tarkka ja luotettava.
d) Ei ole kovin tarkka eikä luotettava."::2:a) ja c).:Ainoastaan b).:b) ja d).:Ainoastaan a).::1 0 0 0::
"Ulko-, väli- ja sisäkorvan täyteaineet ovat esitetyssä järjestyksessään:"::2:Ilma, ilma ja neste.:Neste, ilma ja ilma.:Ilma, neste ja neste.:Neste, neste ja ilma.::1 0 0 0::
Kun ilma-alus kiihdyttää, mitä kuulokivi (otoliitti) viestittää aivoille?::2:Ilma-aluksen nokka nousee.:Ilma-alus on nousussa ja kaartaa.:Ilma-alus kaartaa.:Ilma-aluksen nokka laskee.::1 0 0 0::
"Lentokorkeuksissa, ilmakehän hapen osuus tilavuuden suhteen on:"::2:Sama kuin merenpinnan korkeudella (MSL).:Korkeampi kuin merenpinnan korkeudella (MSL).:Riippuvainen sen hetkisestä korkeudesta.:Pienempi kuin merenpinnan korkeudella (MSL).::1 0 0 0::
"Jos lentäjä kokee menettävänsä asentotajunsa lentäessään olosuhteissa, joissa
on huono lentonäkyvyys, paras tapa selviytyä tilanteesta on:"::2:Luottaa ilma-aluksen mittarinäyttämiin.:"Tietoisesti hidastaa hengityksen tiheyttä kunnes tuntemukset ovat hävinneet ja jatkaa
tämän jälkeen normaalisti.":Nopeuttaa hengityksen tiheyttä.:Keskittyä luiston, nokanasennon ja kallistuksen tuntemuksiin.::1 0 0 0::
Mikä osa hermostosta yleensä säätelee hengitystä?::2:Tahdosta riippumaton hermosto.:Keskushermosto.:Kaikki vastaukset ovat oikein.:Ääreishermosto.::1 0 0 0::
Mikä väittämä on oikein koskien korkeuden arviointia talvella, kun kenttä on luminen ja aurinko paistaa kirkkaana keskipäivän aikaan?::2:korkeutta on tavallista vaikeampi arvioida:kokeneelle ohjaajalle korkeuden arviointi ei tuota ongelmia:lentopaikan ympäristön olosuhteet eivät vaikuta korkeuden arviointiin:korkeuden arviointi on aivan yhtä helppoa kuin muutenkin::1 0 0 0::
Miten utu vaikuttaa muun liikenteen tai maaston muotojen havainnointiin lennolla?::2:Muu liikenne tai maaston muodot näyttäisivät olevan kauempana kuin ne oikeasti ovat.:"Utu saa silmät työskentelemään niin voimakkaasti, että suhteellista liikettä on vaikea
enää havaita.":Muu liikenne tai maaston muodot näyttäisivät olevan lähempänä kuin ne oikeasti ovat.:Utu saa katseen keskittymään kaukaisuuteen.::1 0 0 0::
Yksi tärkeimmistä osatekijöistä matkapahoinvoinnin laukeamisen kannalta on?::2:Epäsuhta visuaalisen näkemisen ja tasapainoelimen aistien välillä.:Nopeat kallistukset kaartoon lähdettäessä.:Suuria G-voimia sisältävien liikkeiden suorittaminen.:Sakkaaminen.::1 0 0 0::
Mikä seuraavista heikentää sopeutumista hämärään?::2:Yli 5000 jalan korkeus matkustamon ilmanpaineessa.:A-vitamiini ruokavaliossa.:Hiilidioksidi.:Typpi.::1 0 0 0::
"Vaara altistua häkämyrkytykselle kasvaa:"::2:Korkeuden kasvaessa.:Ilmanopeuden kasvaessa.:Ilmanpaineen kasvaessa.:Korkeuden pienentyessä.::1 0 0 0::
Mitkä seuraavista lisäävät hypoksian vaikutuksia?::2:Kaikki vastaukset ovat oikein.:Alkoholi.:Lisääntynyt lentokorkeus.:Kohonnut lämpötila.::1 0 0 0::
"Lentäjä lähestyy kiitotietä, joka on paljon isompi kuin hänen kotikentällään oleva
kiitotie. Mikä vaikutus tällä seikalla on lentäjän havainnointiin tilanteessa?"::2:Kiitotie näyttää olevan lähempänä kuin se oikeasti on.:Etäisyydet on helppo arvioida.:Lähestymisessä tulisi käyttää erilaista liukukulmaa.:Kiitotie näyttää olevan kauempana kuin se oikeasti on.::1 0 0 0::
Asentotajun säilyttämisen kannalta mittariolosuhteissa on tärkeää::2: ehdoton luottamus mittareihin: katsoa ulos tuulilasista aina noin 5 sekunnin välein, vaikka horisontti ei näykään: kiinnittää katse ainakin 20-30 sekunnin välein noin 10-20 sekunniksi johonkin muuhun kuin mittareihin, esim. karttojen lukemiseen.: turbulenttisella säällä pyrkiä lentämään mahdollisimman suurella matkalentonopeudella::1 0 0 0::
"Tärkein asentotajuun vaikuttava asia ihmisellä on:"::2:ääreisnäkö:keskeisnäkö:kaarikäytävät:kuulokivielimet::1 0 0 0::
"Riskiä menettää asentotajunsa lennon aikana huonoissa näkösääolosuhteissa
voidaan vähentää:"::2:Luottamalla mittareihin ennemmin kuin muihin tuntemuksiin.:"Vaihtamalla katsetta nopeassa tahdissa ulkoisten referenssien ja ilma-aluksen mittariston
välillä.":Määrätietoisesti keskittymällä lyhyin jaksoin eri taivaan osiin.:Nojaamalla vastakkaiseen suuntaan, jonne ilma-aluksen liike kohdistuu.::1 0 0 0::
"Mitä aiheutuu, kun noustaan yli 18,000 jalan korkeuteen paineistamattomalla
ilma-aluksella ilman lisähappea?"::2:"Hapen osapainetta keuhkoissa ei pystytä säilyttämään ilman, että hapen painetta ei
lisätä.":Kaasut jäävät kehoon loukkuun ja näin ollen estävät typpeä poistumasta verenkierrosta.:Keskikorvassa oleva paine laskee alle sen ilmanpaineen, joka vallitsee matkustamossa.:Hapen osapaine keuhkoissa pysyy samana.::1 0 0 0::
"Miehillä suositeltu maksimi alkoholinkulutus viikossa on ____ yksikköä ja
naisilla ____ yksikköä:"::2:24/16:25/25:16/24:30/20::1 0 0 0::
"Kun lentäjä tekee päätöksiä, onko hänen aikaisemmilla kokemuksillaan
vaikutusta asiaan?"::2:Kyllä, aikaisemmat kokemukset voivat vaikuttaa päätöksentekoon.:Kyllä, mutta vain jos aikaisemmat kokemukset ovat olleet positiivisia.:Ei, jokainen päätös on itsenäinen.:Kyllä, mutta vain jos aikaisemmat kokemukset ovat olleet negatiivisia.::1 0 0 0::
Painestuksen kadotessa korkeudella FL300::2:on huolehdittava ohjaamomiehistön hapensaannista:on asiasta tiedotettava välittömästi ATS-elimelle:on ilmoitettava asiasta matkustamohenkilökunnalle:on estettävä paniikki::1 0 0 0::
"Lisähappea on käytettävä kun lentokorkeus on yli:"::2:13 000ft:5 000 ft:10 000 ft:15 000 ft::1 0 0 0::
Mikä väittämistä on tosi koskien näkökykyä sumussa?::2:maaston kohteet ja muu liikenne näyttävät olevan kauempana kuin ne todellisuudessa ovat:päätä ja silmiä tulisi pitää paikallaan jotta kohde näkyisi paremmin:liikkuvan lentokoneen havaitseminen vaikeutuu sumussa olennaisesti:silmät tarkentuvat kaukaisuuteen (avaruusmyopia)::1 0 0 0::
"Milloin lentäjä voi kokea ""nojaamisharhan""?"::2:Kaikissa lentotiloissa.:Liu'ussa.:Nousussa.:Sekä nousussa, että liu'ussa.::1 0 0 0::
Tasapainoaisti ihmisellä sijaitsee::2: sisäkorvassa : aivolisäkkeessä: välikorvassa: proprioseptiivisessa aistinjärjestelmässä::1 0 0 0::
