"Mihin seuraavista lentäjän tulee pääasiassa turvautua, jos hän menettää
asentotajunsa lentäessään mittarilento-olosuhteissa (IMC)?"::2:Ilma-aluksen mittareihin.:Ulkoisiin näköreferensseihin.:Päänkääntämiseen, palauttaakseen asentotajunsa.:Tasapainon tuntemukseen.::1 0 0 0::
"Vähentääkseen yhteentörmäyksen vaaraa lentokoneeseen, joka saattaa olla
lentäjän kuolleessa kulmassa ja lähestyen samalla suhteellisella suuntimalla, lentäjän tulee:"::2:Katsella ulos systemaattisesti kaiken aikaa.:Suorittaa määrätyin väliajoin tarkistuskaartoja.:Vaihtaa ohjaussuuntaa muutamalla asteella joka kymmenes minuutti.:Kallistaa konetta oikealta vasemmalle muutamia asteita joka kymmenes minuutti.::1 0 0 0::
"Kun henkilö kokee stressiä tai pelkoa, adrenaliinia vapautuu verenkiertoon
aiheuttaen:"::2:Sykkeen nousua.:Sykkeen laskua.:Väsymystä.:Tajunnan menetyksen.::1 0 0 0::
"Lennolla oleva lentäjä kohtaa suoraan törmäyskurssilla vastaan tulevan,
nopeasti lentävän suihkukoneen. Lentäjä havaitsee suihkukoneen, joka näyttää
kasvavan hänen silmissään seuraavasti:"::2:"Aluksi suihkukone näyttää kasvavan hyvin hitaasti, kunnes juuri ennen törmäystä kasvaa
hyvin nopeasti.":Suihkukone näyttää kasvavan tasaisella nopeudella.:Aluksi erittäin nopeasti, mutta lopuksi tasaisella nopeudella.:Nopeasti aluksi ja sitten tasaisella nopeudella törmäykseen asti.::1 0 0 0::
"Akkommodaation tehokkuus silmässä:"::2:Heikkenee, kun linssin elastisuus vähenee.:Ei liity mitenkään linssiin (mykiöön).:Ei ole riippuvainen linssin elastisuudesta.:Kasvaa, kun linssin elastisuus vähenee.::1 0 0 0::
Mikä seuraavista tavoista auttaa välttämään stressiä ohjaamossa?::2:Maltillinen toiminta niin, että et kiirehdi tekemään asioita ennen kuin olet siihen valmis.:Pidä kylmä juoma kädessäsi jatkuvasti.:Kaikki vastaukset ovat oikein.:"Muutat ennakkoon sovittua suunnitelmaan aina kun huomaat poikkeavasi siitä tai olet
suunnitelmasta jäljessä."::1 0 0 0::
Mikä silmän osa hoitaa ääreisnäön alueen ja tottuu hämärään?::2:Sauvasolut.:Tappisolut.:Verkkokalvo.:Keskuskuoppa.::1 0 0 0::
"Paras keino, jolla havaitset toisen ilma-aluksen yöllä, on:"::2:Katsoa kohteen sivulle ja siirrellä katsetta hitaasti.:"Välttää tähyilemästä horisontin alapuolella olevaa aluetta, jotta vältytään näkemästä
maassa olevia valoja.":Tähyillä näkyvällä alueella hyvin nopealla tahdilla.:Katsoa kohteen sivulle ja siirrellä katsetta hyvin nopeasti.::1 0 0 0::
Termi, jota käytetään oikeiden aistimusten väärin tulkinnasta, on?::2:Kangastus.:Hallusinaatio.:Ikävystyminen.:Unelmointi.::1 0 0 0::
Lähestyttävällä lentopaikalla lähestymissektorin maasto on korkeampaa kuin kiitotie. Mitä todennäköisesti tapahtuu laskussa?::2:lasku menee pitkäksi:lasku jää vajaaksi:maasto ei vaikuta laskeutumiseen:säilytetään väärä lähestymisnopeus::1 0 0 0::
Eustachin putki on tukossa ja lentokone kohoaa nopeasti. Mitä tapahtuu?::2:tärykalvo pullistuu ulos:tärykalvo pullistuu sisällepäin:tärykalvo repeää:ei mitään::1 0 0 0::
Kuinka kauan lentäjän tulisi odottaa yleisanestesian jälkeen ennen lentämistä?::2:48 tuntia.:12 tuntia.:24 tuntia.:2 tuntia.::1 0 0 0::
"Eri aistien aivoille lähettämä harhaanjohtava tieto, joka johtaa tilapäiseen
sekaannustilaan, on nimeltään:"::2:Asentotajun menetys.:Hyperventilaatio.:Hypoksia.:Monokromaattisuus.::1 0 0 0::
"Huonokuuloisuuden aiheuttava tekijä, jossa aistisolut vähitellen rappeutuvat
(presbyacusis), on:"::2:Ikä.:Tupakointi.:Vaurio kuuloelimen simpukassa.:Vaurio kaarikäytävissä.::1 0 0 0::
"Ilma-aluksen kapteenilla tulee olla hyvät taidot johtamisen eri osa-alueilla. Mikä
seuraavista ei ole sellainen?"::2:Aggressiivinen itsevarmuus.:Hyvän tilannetietoisuuden ylläpitäminen.:Taito delegoida.:Etukäteissuunnittelu.::1 0 0 0::
"Jos henkilö on ollut sukeltamassa ja on ollut tarvetta käyttää hallittua nousua,
hänen suositeltu odotusaikansa ennen seuraavaa 8000 jalan korkeuteen
(matkustamon painekorkeus) asti ulottuvaa lentoaan on:"::2:24 tuntia.:48 tuntia.:12 tuntia.:4 tuntia.::1 0 0 0::
Mitä seuraavista tupakointi aiheuttaa lentäjille?::2:Yönäkökyky heikentyy 50 prosentilla.:Kohonneen ruumiinlämpötilan, mikä itsessään aiheuttaa tarpeen hengittää lisää happea.:Lisääntynyt hiilidioksidin määrä kehossa, mikä usein johtaa hyperventilaatioon.:Lisääntynyt hyvänolontunne.::1 0 0 0::
Mikä on kansainvälisen standardi-ilmakehän (ISA) ilmanpaine meren pinnalla?::2:1013.25 Hpa.:1014.00 Hpa.:1014.25 Hpa.:50 elohopeatuumaa.::1 0 0 0::
"Aivosolut, jotka eivät saa happea, alkavat kuolla ____ kuluttua:"::2:2 minuutin:30 minuutin:2 tunnin:2 sekunnin::1 0 0 0::
Mikä seuraavista todennäköisimmin aiheuttaa hyperventilaation?::2:Tunnejännitteet, ahdistus ja pelko.:Äärimmäisen hidas hengitystiheys ja vähäinen hapen määrä.:Ketjutupakointi.:Liiallinen alkoholin käyttö.::1 0 0 0::
"Korkea verenpaine, sydänsairaudet ja diabetes ovat yhteydessä:"::2:Liikalihavuuteen.:Koleraan.:Hapenpuutteeseen.:Anorexia nervosaan.::1 0 0 0::
"Suuri määrä hiilimonoksidia ihmiskehossa aiheuttaa:"::2:Lihasvoimien heikkenemisen.:Hyperventilaatiota.:Lisääntynyttä hyvän olon tunnetta.:Kiristävän tunteen otsalla.::1 0 0 0::
"Verrattuna ei-tupakoivaan henkilöön, tupakoitsija saattaa kokea hypoksian oireita:"::2:Matalammalla lentokorkeudella.:Millä lentokorkeudella tahansa.:Samalla lentokorkeudella.:Korkeammalla lentokorkeudella.::1 0 0 0::
Mitkä väittämät pitävät paikkansa? 1. Kun tuijotat kauas tyhjyyteen, kaukonäkö heikkenee. 2. Havaitset vastaantulevan lentokoneen parhaiten pitämällä päätä ja silmiä paikoillaan.::2:1 oikein ja 2 väärin:1 ja 2 oikein:1 väärin ja 2 oikein:molemmat väärin::1 0 0 0::
"Mikä seuraavista Ihmisen suorituskyky -oppiaineessa käytetyistä termeistä
kuvaa yleisesti yhtä muistityyppiä?"::2:Pitkäkestoinen muisti.:Herkkyysmuisti.:Kaikki vastaukset ovat oikein.:Onnellisuusmuisti.::1 0 0 0::
"Taajuusalue, jonka terve nuori ihminen voi kuulla on:"::2:20 - 20.000 sykliä sekunnissa.:500 - 15.000 sykliä sekunnissa.:80 - 20.000 sykliä sekunnissa.:70 - 15.000 sykliä sekunnissa.::1 0 0 0::
Missä silmän osassa sijaitsee tarkan näkemisen keskus?::2:Keskuskuoppa (fovea).:Pupilli.:Sarveiskalvo.:Verkkokalvo.::1 0 0 0::
Anemiassa::2: veren hemoglobiinipitoisuus on normaalia alempi: esiintyy usein unettomuutta: saatta etäisyyden arviointi lennolla olla heikentynyt: veren hapenkuljetuskyky on parantunut::1 0 0 0::
Happisaturaatio kuvaa?::2:Veren hemoglobiinin happikyllästeisyyttä:Veren hiilidioksidipitoisuutta:Veren alkaloidipitoisuutta:Veren happo-emästasapainoa::1 0 0 0::
Hämärässä päivänäkemisen tarkkapiste, on?::2:sokea piste:tarkan näkemisen piste:cupula:sibula::1 0 0 0::
"Mitä sellaisen lentäjän tulisi ajatella, jolla on taipumusta vaaralliseen
asennoitumiseen, kuten haavoittumattomuuden tunteeseen?"::2:Se voisi sattua myös minulle.:Se ei voi sattua minulle.:Ei se voi olla niin paha.:En välitä.::1 0 0 0::
"Mikä on ilmailussa tapahtuvan päätöksentekoprosessin ensimmäinen lähtökohta
vaarallisen asennoitumisen välttämiseksi?"::2:Vaarallisen asennoitumisen tunnistaminen.:Tilanteen haavoittumattomuuden tunnistaminen.:Järkevien päätösten tekeminen.:Vahinkojen minimointi.::1 0 0 0::
"Hyperventilaation aiheuttaa:"::2:Hiilidioksidin puute kehossa.:Liian nopea hengittäminen, joka aiheuttaa hapen puutteen.:Liiallinen määrä hiilidioksidia kehossa.:Liian korkealla lentäminen ilman lisähappea.::1 0 0 0::
"Lennettäessä korkealla ilmakehässä olevan hapen paine on:"::2:Pienempi kuin MSL-korkeudessa.:Korkeampi kuin MSL-korkeudessa.:Muuttumaton, sillä hapen osapaine on riippumaton lentokorkeudesta.:Sama kuin merenpintakorkeudessa (MSL).::1 0 0 0::
Hyperventilaatiossa::2:aivot kärsivät hapenpuutteesta:on kyse psykofysiologisesta reaktiosta:veressä on liikaa hiilidioksidia:"keho reagoi samalla tavalla kuin liiallisessa positiivisessä G:ssä"::1 0 0 0::
"Tasapainoelin havaitsee ______ -kiihtyvyyksiä:"::2:Suoraviivaisia.:Kulma-.:Kulma- ja suoraviivaisia.:Positiivisia G-voima.::1 0 0 0::
Stressiadaptaatio::2: helpottaa stressinsietoa siihen vähitellen tottumisen takia: kehittyy, kun stressi loppuu: syntyy hapenpuutteen vaikutuksesta korkealla lennettäessä: aiheuttaa  toimintakyvyttömyyden stressitilanteessa::1 0 0 0::
"Yöllä on helpompi tarkkailla kohdetta, jos:"::2:Katsot kohteen yhdelle reunalle.:Katsot noin 50 astetta kohteen jommallekummalle puolelle.:Katsot suoraan kohdetta samalla kun pidät silmiäsi niin auki kuin mahdollista.:Katsot suoraan kohdetta.::1 0 0 0::
Yöadaptaatioon kuluu noin ___ sauvasoluilta ja ___ tappisoluilta.::2:30 minuuttia/7 minuuttia:25 minuuttia/45 minuuttia:7 minuuttia/30 minuuttia:15 minuuttia/20 minuuttia::1 0 0 0::
"Keuhkokapillaarien ohuista seinämistä menevät läpi:"::2:Kaasut.:Vesi.:Proteiinit.:Veren punasolut.::1 0 0 0::
Mikä seuraavista voi aiheuttaa pyörtymistä?::2:Yllättävä/äkillinen järkytys.:Kaikki vastaukset ovat oikein.:Liian huolellinen lennonsuunnittelu.:Liian nopea silmien liikuttelu.::1 0 0 0::
"Mihin seuraavista lentäjän tulisi ensisijaisesti turvautua, jos hän menettää
asentotajunsa näkölentosääolosuhteissa(VMC)?"::2:Lentokoneen mittareihin.:Näköaistiin.:Pään kääntämiseen palautuakseen asentotajun menetyksestä.:Tasapainoaistiin.::1 0 0 0::
"Paras tekniikka toisen ilma-aluksen havaitsemiseksi yöllä on:"::2:Katsoa kaukaisuuteen ja tähyillä hitaasti.:"Välttää tähyilemästä horisontin alapuolella olevaa aluetta, jotta vältytään näkemästä
maassa olevia valoja.":Välttää tuijottamasta suoraan paikkaan, jossa ilma-aluksen oletetaan lentävän.:Kääntää päätä ja siirtää katsetta nopeasti koko näkyvissä olevalla alueella.::1 0 0 0::
Autokinesis on::2: näköön liittyvä harha-aistimus yksinäisen valopisteen liikkumisesta pimeällä : autopilotin käyttö mittarilennossa: turbulenssiin liittyvää pahoinvoinnin tunnetta  lennolla: johtokoneen seuraamista osastotaitolennossa::1 0 0 0::
Tulet laskuun normaalia kapeammalle kiitotielle. On mahdollista että::2:lasku jää vajaaksi:lasku menee pitkäksi:ylösveto on todennäköinen:leveys ei vaikuta suoritukseen::1 0 0 0::
"Ilmailussa käytetty termi ""fysiologinen korkeus"" tarkoittaa"::2:korkeutta, jossa terveen verrokin hapenottokyky on sama kuin ko. henkilön merenpinnan tasalla:sitä korkeutta, jolla lennon aikana ollaan:todellista korkeutta meren pinnasta:maksimikorkeutta, johon ilman lisähappea voidaan nousta::1 0 0 0::
Mikä on Eustachin putken (korvatorvi) tarkoitus?::2:Tasata ympäristön ilmanpaine molemmille puolille tärykalvoa.:Tasata ympäristön ilmanpaine tärykalvosta keskikorvan puolelle.:Päästää ääniaallot keskikorvan kautta kuulohermoon.:Tasata ympäristön ilmanpaine molemmille puolille tasapainoelintä.::1 0 0 0::
"Millä kaasulla, joka imeytyy elimistöön normaalin hengityksen aikana, on suuri
merkitys alipainetaudin kannalta?"::2:Typpi.:Hiilidioksidi.:Hiilimonoksidi.:Happi.::1 0 0 0::
"Hypoksialle todennäköinen oire/oireet:"::2:Kaikki vastaukset ovat oikein.:Kihelmöivät sormet ja varpaat.:Tajuttomuus.:Arvostelukyvyn heikkeneminen.::1 0 0 0::
Lyhytaikaista muistia tarvitaan::2:"ns. ""työmuistina"" ristiintarkistuksessa (cross check) mittarilukemien tulkitsemiseen""":hätätilanne-toimenpiteitä suoritettaessa:lentosuunnitelmalaskelman tekemiseen:teoria-aineiden kokeisiin valmistautuessa::1 0 0 0::
"Lentäjät menettävät helpommin asentotajunsa, jos:"::2:Lentotilan määrittämiseen käytetään apuna kehon tuntemuksia.:He eivät huomioi kaikkia kehon tuntemuksia.:He eivät huomioi tuntemuksiaan lihaksissa ja keskikorvassa.:Katsetta muutetaan usein lentomittareiden ristiintarkkailun aikana.::1 0 0 0::
Äänenvoimakkuutta mittaava suure on?::2:Desibeli.:Pascal.:Hertsi.:Kierros/sekunti.::1 0 0 0::
"Millä keino(i)lla lentäjän pitäisi pystyä selättämään tai välttämään jatkossa
hyperventilaatiota?"::2:Hengitystiheyden pienentäminen, hengittäminen pussiin tai ääneen puhuminen.:Hengitystiheyden lisääminen, jotta keuhkojen ilmanvaihto lisääntyisi.:Lentokoneen hallinta lennonvalvontamittareita läheltä seuraamalla.:Hengitystiheyden lisääminen.::1 0 0 0::
"Akkommodaatio eli linssin voimakkuus mukauttaa valon säteet lähellä olevista
kohteista tarkannäkemisen keskukseen. Akkommodaatiota säätelee:"::2:Kiliaarilihas.:Verkkokalvo.:Tappi- ja sauvasolut.:Värikalvo (Iris).::1 0 0 0::
Sisäkorvan otoliittielin (sacculus) aistii::2: suoraviivaista kiihtyvyyttä: kulmanopeutta: kulmakiihtyvyyttä: kiihtyvyysmonikertaa::1 0 0 0::
Mikä seuraavista kuljettaa happea läpi kehon?::2:Veren punasolut.:Veren valkosolut.:Vesi.:Veriplasma.::1 0 0 0::
Tuijotat yksittäistä tähteä yölennolla, kun se yht?äkkiä näyttää liikkuvan itsestään, kyseessä on?::2:Auto kinesis - harha:Somatogyrinen harha:Somatografinen harha:Vektio harha::1 0 0 0::
"Hypoksialle todennäköinen oire/oireet:"::2:Kaikki vastaukset ovat oikein.:Kohonnut sydämen syke.:Formikaatio eli tunne siitä, että muurahainen kävelee iholla.:Syanoosi eli sinertävyys.::1 0 0 0::
"Värisokeuden, tai oikeammalta termiltään väriheikkouden, aiheuttaa:"::2:Verkkokalvon väriherkkien tappisolujen rakenteen vioittuminen.:Kiliaarilihaksen viallinen toiminta.:Silmässä olevan linssin kudoksen vioittuminen.:Lyhentynyt silmämuna.::1 0 0 0::
Mikä aiheuttaa siniset huulet?::2:Hapenpuute.:Hiilimonoksidimyrkytys.:Positiivisten G-voimien vaikutus.:Hyperventilaatio.::1 0 0 0::
"Hypoksia on seurausta:"::2:Hapen puutteesta kehossa.:Riittämätön määrä happea ilmassa.:Kaikki vastaukset ovat oikein.:Liiallinen typen määrä verenkierrossa.::1 0 0 0::
"Tiedon toistaminen useita kertoja siirtää sen pitkäaikaiseen muistiin. Tätä kutsutaan nimellä:"::2:Harjoittelu.:Muisti-induktio.:Summaaminen.:Kehottaminen.::1 0 0 0::
"Jos ilmakehän paine pienenee, hapen osapaine vastaavasti:"::2:Pienenee.:Pysyy samana.:Ei vaikutusta, sillä se ei ole riippuvainen ilmanpaineesta.:Suurenee.::1 0 0 0::
"Kaukotaittoisuuden aiheuttaa _____ silmämuna, joka on korjattavissa _____.
Likitaittoisuuden aiheuttaa _____ silmämuna, joka on korjattavissa _____."::2:Lyhentynyt / kuperalla linssillä / pidentynyt / koveralla linssillä.:Pidentynyt / kuperalla linssillä / lyhentynyt / koveralla linssillä.:Lyhentynyt / koveralla linssillä / pidentynyt / kuperalla linssillä.:Pidentynyt / koveralla linssillä / lyhentynyt / kuperalla linssillä.::1 0 0 0::
Mikä seuraavista parhaiten kuvaa hypoksiaa?::2:Hapen puute elimistössä.:Kaasukuplien muodostuminen niveliin ja lihaksiin.:Hengitetyn ilmamäärän epänormaali väheneminen.:Hengitetyn ilmamäärän epänormaali lisääntyminen.::1 0 0 0::
"Olet joutunut vahingossa pilveen ja suoritat 180 asteen mittarikaarron vastasuuntaan. Oikaisussa takaisin suoraan vaakalentoon tunnet koneen kallistuvan ""väärälle""/toiselle puolelle. Mittareiden mukaan kone on vaakalennossa. Olet kokenut:"::2:Somatogyrisen harhan:Somatografisen harhan:Vektioharhan:Autokinesisharhan::1 0 0 0::
"Mikäli lentäjä on reilusti ylipainoinen, on hänellä suurentunut riski:"::2:Saada sydänkohtaus.:Hypotermiaan.:Altistua hypoksialle lennettäessä korkealla.:Kaikki vastaukset ovat oikein.::1 0 0 0::
"Yksi keino parantaa yönäkökyvyn tehokkuutta on:"::2:Kiinnittää katse pois katsottavan kohteen keskeltä.:Katsoa kaukaisuuteen.:Katsoa suoraan kohteeseen.:Lisätä ohjaamon sisävalaistusta.::1 0 0 0::
"Paras ennaltaehkäisevä keino välttää stroboskooppi-ilmiö, kun henkilöllä
havaitaan sen oireita?"::2:Sijoittaa henkilö varjoon ja saada hänet sulkemaan silmänsä.:Annetaan henkilölle jokin tehtävä, jotta hän kiinnittäisi huomionsa muualle.:Sijoittaa henkilö aurinkoiseen paikkaan.:Ei tarvita toimenpiteitä, sillä oireet kestävät vain lyhyen aikaa.::1 0 0 0::
"Nousulennon aikana 18,000 jalan korkeuteen, hapen prosenttiosuus
ympäröivässä ilmakehässä:"::2:Pysyy samana.:Pienenee.:Räjähtää.:Kasvaa.::1 0 0 0::
Millä todennäköisyydellä lentäjä jättää käyttämättä tärkeän tiedon ongelmatilanteessa?::2:suuremmalla kuin normaalisti:yhtä suurella kun muutenkin:pienemmällä kuin normaalisti:ei vaikutusta::1 0 0 0::
"Lennät 6000ft korkeudella ja lennolla mukana oleva kaverisi alkaa tuntea
kihelmöintiä, huimausta ja näköhäiriöitä, joita seuraa tajuttomuus. Kaverisi
todennäköisesti kärsii:"::2:Hapen puutteesta.:Angiinasta.:Ruokamyrkytyksestä.:Hyperventilaatiosta.::1 0 0 0::
"Harha-aistimuksen siitä, että ilma-alus lentää korkeammalla kuin mitä se oikeasti on, voi aiheuttaa:"::2:Nouseva maasto.:Leveä kiitotie.:Aleneva maasto.:Utuinen ilmanala.::1 0 0 0::
Mitkä väittämät pitävät paikkansa? 1. Hyvä lentäjä tekee monta asiaa yhtä aikaa. 2. Tiedonkäsittely prosessissa mitä useammin toistat prosessia - tulos paranee::2:1 väärin ja 2 oikein:1 ja 2 oikein:1 oikein ja 2 väärin:molemmat väärin::1 0 0 0::
"Olet suunnitellut ottavasi pari kaveria mukaasi lennolle. Ajankohtana, jolloin
olitte sopineet lentävänne, sääolosuhteet ovat marginaaliset ja kiitotiellä
puhaltaa voimakas sivutuuli. Pätevänä riskin arvioitsijana, minkä seuraavista
päätöksistä teet?"::2:Muutat lennon ajankohdan, siitäkin huolimatta, että ystäväsi pettyvät.:"Lennät lennon suunnitellusti, koska lentosuunnitelmassa pysyttäytyminen on aina
järkevää, jos vain suinkin pystyt.":"Ennen kuin arvioit tilanteen itse, kysyt ystäviltäsi, että ovatko he valmiit lentämään
kyseisissä olosuhteissa.":"Jatkat lennon suorittamista suunnitellusti, sillä tämä on hyvä tilaisuus harjoitella
lentämistä vaikeissa olosuhteissa."::1 0 0 0::
"Jotta silmät tottuisivat pimeään, mitä lentäjän olisi hyvä tehdä valmistautuessaan
yölennolle?"::2:Välttää kirkkaita valkoisia valoja vähintään 30 minuuttia ennen lentoa.:Pitää aurinkolaseja auringonlaskun jälkeen lennolle saakka.:Välttää punaisia valoja vähintään 30 minuuttia ennen lentoa.:Pysytellä pimeässä huoneessa vähintään 60 minuuttia ennen lentoa.::1 0 0 0::
"Silmään tulevan valon määrää säätelee:"::2:Pupilli.:Linssi.:Sarveiskalvo.:Verkkokalvo.::1 0 0 0::
"Mikä on yleinen tekijä, joka vaikuttaa eniten ennaltaehkäistävissä oleviin
onnettomuuksiin?"::2:Inhimillinen erehdys.:Rakenteiden pettäminen.:Mekaaninen vika.:Toisten osallisten tekemät virheet.::1 0 0 0::
Mikä on tärkein aisti asentotajun kannalta?::2:Näköaisti.:Kaikilla aisteilla on oma roolinsa tilannetietoisuuden kannalta.:Kuuloaisti ja tasapainoaisti.:"Istuinpaikka-aisti (""perstunto"")."::1 0 0 0::
Minkä kaasun määrä veressä säätelee hengityksen tiheyttä ja syvyyttä?::2:Hiilidioksidi.:Happi.:Typpi.:Hiilimonoksidi.::1 0 0 0::
Mikä elintoiminta huolehtii hapen jakelusta kehossa?::2:Verenkiertoelimistö.:Keskushermosto.:Hapetusjärjestelmä.:Hengityselimistö.::1 0 0 0::
Jos joudut sairauden vuoksi lääkekuurille::2: neuvottelet lentotehtävien suorittamisesta ilmailulääkärin (AME) kanssa: voit tarkistaa terveyskeskuksesta onko lentotehtävien suorittaminen mahdollista kuurin aikana: lääkekuuri ei haittaa, ellet ole muuten huonossa kunnossa: et voi ottaa vastaan lentotehtäviä::1 0 0 0::
"Kenellä on viimeinen vastuu siitä, että lentäjä on lentokelpoisessa kunnossa
tietylle lennolle, vaikka hänellä olisikin voimassaoleva lääketieteellinen
kelpoisuustodistus?"::2:Lentäjä itse.:Ilmailulääkäri.:Lennonjohtaja.:Viranomainen.::1 0 0 0::
"Kansainvälisen standardi-ilmakehän (ISA) mukaisesti, korkeuden kasvaessa troposfäärissä, ilman tiheys:"::2:Pienenee.:Ei vaikutusta, sillä ilmantiheys ei ole riippuvainen korkeudesta.:Pysyy samana.:Suurenee.::1 0 0 0::
"Kaksi lentäjää, joista toinen tuntee tilanteen positiivisesti jännittävänä ja toinen pelottavana. Mitä yhteisiä ""oireita"" lentäjillä on?"::2:heidän vireystila on kasvanut:heidän kädet vapisevat:heidän päätöksentekokyky on kasvanut:kaikki vaihtoehdot ovat oikein::1 0 0 0::
Missä sijaitsee sokea täplä?::2:Kohdassa, jossa verkkokalvo ja näköhermo yhdistyvät.:Mykiössä.:Keskuskuopassa.:Iiriksessä.::1 0 0 0::
Mikä seuraavista on suositeltu menetelmä välttää tai päästä eroon tilateenteesta jossa asentotaju uhataan menettää::2:Vähennä pään ja silmien liikkeet niin vähäisiksi kuin mahdollista.:Vältä jyrkkiä kaartoja ja äkkinäisiä ohjainten poikkeutuksia.:Systemaattisesti ja lyhyin väliajoin keskitä katseesi eri taivaan osiin.:Luota ainoastaan ilma-aluksen mittarinäyttämiin.::1 0 0 0::
"Millä tekniikalla lentäjän kannattaa katsella vasemmalla ja oikealla olevaa muuta
liikennettä, suoran vaakalennon aikana?"::2:Systemaattisesti keskittyä eri taivaan osiin lyhyin väliajoin.:Katsoa kaukaisuuteen ja tähyillä hitaasti.:Jatkuvaa pälyilyä tuulilasin kautta vasemmalle ja oikealle.:Keskittyä ääreisnäön alueella havaittuihin suhteellisiin liikkeisiin.::1 0 0 0::
"Kun tehdään lähestymistä laskevalle kiitotielle (alamäki), on vaarana että lähestyminen:"::2:menee pitkäksi:jää lyhyeksi:ei vaikuta:päättyy ylösvetoon::1 0 0 0::
Termi BLACK-OUT tarkoittaa::2: äkillistä näkökentän pimenemistä g-rasituksessa: lumisokeutta: utua  illan hämärtyessä: varjokatoa::1 0 0 0::
Hapenpuute ei voi syntyä::2:hyperventilaatiossa:jos olet hyvässä fyysisessä kunnossa:"1000ft:ssä tai alle lennettäessä":paineistetun koneen kabiinissa::1 0 0 0::
"Hyvin suoritettu lentoa edeltävä ohjeistus (briefaus) on tärkeää. Mikä seuraavista
saattaa olla seurauksena, jos suoritetaan ohjeistus (briefaus) huonosti?"::2:Epätietoisuus lisääntyy.:Tiedot ymmärretään hyvin.:Epätietoisuus vähenee.:Tiedon välittäminen parantuu.::1 0 0 0::
"Verenluovutuksen jälkeen, mikä on minimi aika joka lentäjän tulee odottaa ennen
lentämistä?"::2:24 tuntia.:48 tuntia.:12 tuntia.:2 tuntia.::1 0 0 0::
Mitä on melun aiheuttama huonokuuloisuus?::2:Kuulon menettäminen kuuloelimen simpukan vaurion vuoksi.:Kuulon menettäminen keskikorvan vaurion vuoksi.:Kuulon menettäminen kuuloluiden vaurion vuoksi.:Kuulon menettäminen tasapainoelimen vaurion vuoksi.::1 0 0 0::
"Veren happisaturaatio pysyy siedettävällä tasolla korkeudelle (ilman lisähappea):"::2:10000 ft:1000 ft:5000 ft:13000 ft::1 0 0 0::
Mikä seuraavista pitää paikkansa, puhuttaessa alkoholista ja ihmisistä?::2:Alkoholin vaikutuksesta lentäjä altistuu herkemmin hypoksialle.:Pieni määrä alkoholia ei vaikuta lentotaitoon.:Pieni määrä alkoholia parantaa toimintoja.:Kahvi auttaa haihduttamaan alkoholia ja lievittää krapulaa.::1 0 0 0::
Unettomuus tai unirytmin häiriöt voivat aiheuttaa::2: lisääntyneen suoritusvirhemahdollisuuden: valveillaolokyvyn paranemista: nälän tunteen esiintymistä: rauhallisuutta ja helpottunutta keskittymistä suorituksiin::1 0 0 0::
"Yksinlennolla olevan lentäjän, joka epäilee menettäneensä asentotajunsa, tulee:"::2:Luottaa mittarinäyttämiin.:"Nielaista kovaa, nipistää sieraimista ja puhaltaa nenän kautta, jotta Eustachin putki
(korvatorvi) aukeaisi.":Luottaa asentoaistimuksiinsa.:Räpyttää silmiään useita kertoja.::1 0 0 0::
"Ennen kuin lentäjä aloittaa liikehtimisen koneellaan, hänen tulisi:"::2:Silmämääräisesti katsoa ja tarkistaa koko alue törmäysten välttämiseksi.:Ilmoittaa aikeistaan lähimmällä käyttökelpoisella radiotaajuudella.:Tarkistaa korkeus, ilmanopeus ja lentosuunta.:Aina ensin pyytää lennonjohtajalta selvitys.::1 0 0 0::
Mitä sisäkorvan sacculus aistii?::2:suoraviivaisia kiihtyvyyksiä:kulmakiihtyvyyksiä:painevoimia:coriolisvoimia::1 0 0 0::
Noin 18000 jalan korkeudessa ilmakehän paine on alentunut noin puoleen ja tällöin::2: hapen osapaine on noin puolet merenpinnan tason arvosta: ilman happipitoisuus on 11,5 %: ilman typpipitoisuus on 39%: hapen osapaine on säilynyt samana kuin merenpinnan tasolla::1 0 0 0::
Lennon aikana matkustaja valittaa että vatsaa turvottaa kivuliaasti. Käsket häntä::2:päästämään kaasut ulos:hieroa vatsaansa:kaikki vaihtoedot ovat oikein:olla juomatta coca-colaa ennen lentoa::1 0 0 0::
Mikä sydämen osa supistuessaan saa aikaiseksi pulssin?::2:Vasen kammio.:Oikea eteinen.:Vasen eteinen.:Oikea kammio.::1 0 0 0::
"Ilmakehässä olevan ilman koostumus:"::2:Typpi (78 %), Happi (21%), Hiilidioksidi (0.03%) ja Argon (1%).:Typpi (1%), Happi (78%), Hiilidioksidi (21%) ja Argon (0.03%).:Typpi (21%), Happi (0.03%), Hiilidioksidi (78%) ja Argon (1%).:Typpi (78%), Happi (21%), Hiilidioksidi (0.03%) ja Vety (1%).::1 0 0 0::
"Matkalennolla, FL80, matkustaja alkaa valittamaan vastakipuja, sinä:"::2:"Käsket hänen päästää ""ilmat pihalle"" rectumin kautta":Tarjoat Coca-colaan, jotta matkustaja saisi röyhtäistyä:Nostat lentokorkeutta, jotta paine vatsassa kasvaisi:suosittelet syömään seuraavalla kerralla ennen lentoa hernekeittoa::1 0 0 0::
Silmän kyky nähdä eri etäisyyksille::2:kulkee nimellä akkomodaatio:kulkee nimellä adaptaatio:kulkee nimellä diopria:syntyy täydellisesti 30 sekunnissa::1 0 0 0::
"Käytettäessä happea nopea tai erityisen syvään hengittäminen saattaa aiheuttaa:"::2:Hyperventilaation.:Hypoksian.:Barotiitin.:Barosinusiitin.::1 0 0 0::
"Nähdäkseen tarkasti kohti lentävän ilma-aluksen, jonka silmä on jo havainnut,
lentäjän tulisi:"::2:Aloittaa edessään olevan ilmatilan systemaattinen tarkkailu.:Katsoa suoraan kohti vastaan tulevaa ilma-alusta.:Tarkentaa katse vastaan tulevan ilma-aluksen yhdelle sen reunoista.:"Räpäyttää silmiään useita kertoja saadakseen vastaan tulevasta ilma-aluksesta
tarkemman kuvan."::1 0 0 0::
